{
  "$schema": "http://json-schema.org/draft-07/schema#",
  "$id": "https://raw.githubusercontent.com/mo9652962-ai/circuit-agent/main/specs/netlist_schema.json",
  "title": "CircuitAgent Netlist & Circuit Specification",
  "description": "Standardized schema for the CircuitBlocks intermediate representation (IR), connecting prompt synthesizers with EDA routing compilers. The canonical shape emitted by `synthesize_from_prompt` nests connections under `netlist`; a flat shape with root-level `connections` is also accepted for hand-authored input.",
  "type": "object",
  "anyOf": [
    {
      "required": [
        "netlist"
      ]
    },
    {
      "required": [
        "connections"
      ]
    }
  ],
  "properties": {
    "chip_id": {
      "type": "string",
      "description": "Target microcontroller or SoC identifier.",
      "enum": [
        "ESP32-C3",
        "ESP32-S3",
        "RP2040",
        "STM32F103C8T6",
        "STC89C52RC",
        "CUSTOM"
      ]
    },
    "prompt": {
      "type": "string",
      "description": "Human natural-language prompt or intent description that generated this specification."
    },
    "board": {
      "type": "object",
      "description": "Physical board constraints and PCB layer configuration.",
      "properties": {
        "layers": {
          "type": "integer",
          "description": "Number of copper layers (e.g. 2 for basic boards, 4 for JLC04161H impedance-controlled boards).",
          "enum": [
            2,
            4,
            6
          ]
        },
        "width_mm": {
          "type": "number",
          "description": "Board width in millimeters.",
          "minimum": 10.0,
          "maximum": 500.0
        },
        "height_mm": {
          "type": "number",
          "description": "Board height in millimeters.",
          "minimum": 10.0,
          "maximum": 500.0
        },
        "stackup": {
          "type": "string",
          "description": "Layer stackup standard identifier.",
          "enum": [
            "JLC04161H",
            "STANDARD_2LAYER",
            "CUSTOM"
          ]
        }
      }
    },
    "modules": {
      "type": "object",
      "description": "Key-value dictionary mapping component reference designators to their electrical specifications.",
      "additionalProperties": {
        "type": "object",
        "required": [
          "kind",
          "package"
        ],
        "properties": {
          "kind": {
            "type": "string",
            "description": "Component electrical class or architectural block type.",
            "enum": [
              "MCU",
              "CONNECTOR",
              "IC",
              "LDO",
              "POWER",
              "RESISTOR",
              "CAPACITOR",
              "INDUCTOR",
              "LED",
              "DIODE",
              "CRYSTAL",
              "OSCILLATOR",
              "BUTTON",
              "SWITCH",
              "BUZZER",
              "SENSOR",
              "HEADER",
              "TESTPOINT",
              "FIDUCIAL",
              "TVS",
              "MOSFET",
              "TRANSISTOR",
              "ZENER",
              "FERRITE_BEAD",
              "BATTERY",
              "TERMINAL"
            ]
          },
          "value": {
            "type": "string",
            "description": "Component nominal value or part model (e.g. 10k, 100nF, AMS1117-3.3, BLUE)."
          },
          "package": {
            "type": "string",
            "description": "Standardized EDA footprint / package identifier (e.g. R0603, C0603, SOT-223, QFN-32_EP)."
          },
          "lcsc": {
            "type": "string",
            "description": "LCSC / JLCPCB Part Number prefix with C followed by digits (e.g. C25804, C6186).",
            "pattern": "^C[0-9]+$"
          },
          "designator": {
            "type": "string",
            "description": "Explicit reference designator (e.g. U1, R1, C1, J1)."
          }
        }
      }
    },
    "connections": {
      "$ref": "#/definitions/connections"
    },
    "block_names": {
      "type": "array",
      "description": "CircuitBlocks that the synthesizer selected for this design.",
      "items": {
        "type": "string"
      }
    },
    "unmatched": {
      "type": "array",
      "description": "Features the caller requested that this DSL cannot build yet. An actionable capability signal.",
      "items": {
        "type": "string"
      }
    },
    "not_requested": {
      "type": "array",
      "description": "Optional blocks the prompt did not mention. Informational only — not a capability gap.",
      "items": {
        "type": "string"
      }
    },
    "netlist": {
      "type": "object",
      "description": "Nested netlist container — the canonical shape produced by the synthesizer.",
      "required": [
        "connections"
      ],
      "properties": {
        "connections": {
          "$ref": "#/definitions/connections"
        },
        "modules": {
          "type": "object",
          "description": "Optional duplicate of the root-level modules map, carried for consumers that read the netlist standalone."
        }
      }
    }
  },
  "definitions": {
    "connections": {
      "type": "array",
      "description": "Complete netlist connections across physical pins and signals.",
      "minItems": 1,
      "items": {
        "type": "object",
        "required": [
          "net",
          "points"
        ],
        "properties": {
          "net": {
            "type": "string",
            "description": "Normalized net identifier (e.g. /GND, /+3.3V, /VBUS, /SWDIO).",
            "pattern": "^/[A-Za-z0-9_+.-]+$"
          },
          "class": {
            "type": "string",
            "description": "Netclass governing trace width, clearance, and routing constraints.",
            "enum": [
              "POWER",
              "GROUND",
              "SIGNAL",
              "USB_DIFF_90",
              "CLOCK_HF",
              "ANALOG"
            ]
          },
          "points": {
            "type": "array",
            "description": "Component pin endpoints participating in this electrical node.",
            "minItems": 1,
            "items": {
              "type": "string",
              "description": "Physical component endpoint in DESIGNATOR.PIN format (e.g. U1.1, J_USB1.VBUS).",
              "pattern": "^[A-Za-z0-9_]+(\\.[A-Za-z0-9_]+)?$"
            }
          }
        }
      }
    }
  }
}